{"aggregation":{"dispersion":"median_absolute_deviation","method":"median","minimum_source_records":4},"comparability":{"must_match":["participant","simulator","car","track","layout","protocol_version","segment_definition","metric_definition","normalization_contract","configuration_identity","product_build"],"permitted_variation":[{"field":"condition_semantics","justification":"This field is the compared factor and must differ between the arms.","retained_as":"covariate"},{"field":"coaching_state","justification":"This field is the compared factor and must differ between the arms.","retained_as":"covariate"}]},"confounds":{"controlled":["Driver, simulator, car, track, and layout are held fixed by the must-match comparability guard","Exact fingerprint-bound synthetic setup and build identities are held fixed by the must-match guard","Segment geometry is single-valued across every contributing dataset","Metric definition and normalization contract are held fixed"],"measured_covariates":["lap number","within-arm order index","concept coverage ratio"],"unavailable":["Fuel state is not represented in normalized v1 records","Tyre state and temperature history are not represented","Traffic and other cars on track are not represented","Ambient and track conditions are not represented in this corpus"]},"evidence_set_id":"synthetic-paired-corner-speed-holdout","exclusion_rules":[{"description":"Exclude records positioned outside the declared segment region or phase.","preregistered":true,"rule_id":"outside-segment","stage":"outside_segment"},{"description":"Exclude records from a block whose condition the protocol assigns to no declared arm.","preregistered":true,"rule_id":"unassigned-condition","stage":"protocol_mismatch"},{"description":"Exclude records belonging to a lap the source marked invalid.","preregistered":true,"rule_id":"invalid-lap","stage":"invalid_lap"},{"description":"Exclude records carrying an incident or off-track state.","preregistered":true,"rule_id":"incident-affected","stage":"incident_affected"},{"description":"Exclude records carrying a pit, replay, or discontinuity quality flag.","preregistered":true,"rule_id":"discontinuity","stage":"pit_replay_discontinuity"},{"description":"Exclude units below the declared minimum record count or concept-coverage ratio.","preregistered":true,"rule_id":"thin-unit","stage":"insufficient_coverage"}],"experimental_unit":"lap","factor":{"arms":[{"arm":"baseline","coaching_state":"disabled","condition_ids":["synthetic-baseline"],"protocol_condition":"A fabricated block collected without the declared intervention."},{"arm":"intervention","coaching_state":"enabled","condition_ids":["synthetic-intervention"],"protocol_condition":"A fabricated block collected with the declared intervention applied for its full duration"}],"factor_id":"block-condition","varies_at":"block"},"holdout":{"policy":"reserved_blocks","replication_scope":"different_session","reserved":["block-05","block-06","block-07","block-08"]},"inclusion_rules":[{"description":"Include records positioned inside the declared segment region on a lap of an assigned block.","preregistered":true,"rule_id":"in-segment","stage":"source_records"}],"limitations":["Every value in this evidence set is fabricated. It demonstrates machinery and cannot support any racing conclusion.","Fuel, tyre, traffic, condition, setup, and product-build controls are unavailable in this corpus.","One fabricated participant supplies every unit, so nothing here generalizes beyond that participant."],"pairing":{"key":["participant","car","track","layout","session_id","order_index"],"kind":"paired","unpaired_justification":null},"protocol":{"experiment_id":"synthetic-inference-controlled","experiment_version":"1.0.0","freeze_id":"synthetic-inference-controlled.freeze","freeze_sha256":"a65510edeb9c00b1d27e4ebbb809cd1bf8139ae759c5c3ba66dcba21c53ca30d"},"purpose":"Identical to the paired corner-speed evidence set except that two fabricated blocks are reserved before construction and withheld from the primary analysis scope.","resampling_unit":"block","schema_version":"apex-labs.evidence-set-definition/v1","segment":{"segment_definition_id":"synthetic-corner-a","sha256":"248114360fd4dc46d8f266dc3695a273a769430cc1ddfe6ae8a31ba002037b2f","version":"1.0.0"},"synthetic":true,"title":"Paired corner minimum speed with two fabricated blocks reserved for replication","unit_metric":{"directionality":"higher_is_better","extractor":{"concept":"speed","kind":"segment_aggregate","method":"minimum","record_type":"telemetry_sample"},"metric_id":"segment-minimum-speed","sha256":"8987ddbdfe09906981d9950bf44d80a41f9ed15d4a631a0345bf5d6324d56291","unit":"m/s","version":"1.0.0"},"version":"1.0.0"}
